{
  "event_id": "90000000-0000-0000-0000-000000000001",
  "event_type": "SeatHeld.v1",
  "version": 1,
  "occurred_at": "2026-09-19T12:00:00Z",
  "correlation_id": "90000000-0000-0000-0000-000000000002",
  "causation_id": "90000000-0000-0000-0000-000000000003",
  "payload": {
    "trip_id": "40000000-0000-0000-0000-000000000001",
    "seat_id": "70000000-0000-0000-0000-000000000001",
    "segment_indices": [1, 2]
  }
}
